{
  "body": {
    "event_id": "01JZ7N6A4M6Y8W5K2H7DGKX4PA",
    "workspace_id": "w_01KWQ8RXZ5M6GQDHMCR90681HC",
    "stream_id": "s_01KWQ8RXZ5M6GQDHMCR90681HD",
    "type": "message.created",
    "type_version": 1,
    "author_user_id": "u_01KWQ8RXZ5M6GQDHMCR90681HE",
    "author_device_id": "d_01KWQ8RXZ5M6GQDHMCR90681HF",
    "client_created_at": "2026-07-04T18:22:10.123Z",
    "payload": {
      "message_id": "m_01KWQ8RXZ5M6GQDHMCR90681HG",
      "text": "Hello everyone",
      "format": "markdown",
      "thread_root_id": null,
      "file_ids": [],
      "mentions": ["u_01KWQ8RXZ5M6GQDHMCR90681HH"]
    }
  },
  "event_hash": "sha256:9f2c0000000000000000000000000000000000000000000000000000000000",
  "signature": null,
  "server": {
    "server_sequence": 9284,
    "server_received_at": "2026-07-04T18:22:10.456Z",
    "payload_redacted": false
  }
}
